<?xml version="1.0" encoding="UTF-8" standalone="no"?>
<Ipar xmlns:xsi="http://www.w3.org/2001/XMLSchema-instance" xsi:noNamespaceSchemaLocation="XMLSchemaFU7OMC.xsd">
    <Gyar Gyarkod="A1">
        <Nev>AcélMűvek</Nev>
        <Cim>
            <Varos>Miskolc</Varos>
            <Utca>Szép lány</Utca>
            <Hazszam>54</Hazszam>
        </Cim>
        <Adoszam>111111111-1-11</Adoszam>

        <!-- Több műszakvezető -->
        <MuszakVezeto Kod="M1">
            <Nev>Trombitás Elemér</Nev>
            <Vegzettseg>Lakatos</Vegzettseg>
            <Eletkor>62</Eletkor>
        </MuszakVezeto>
        <MuszakVezeto Kod="M2">
            <Nev>Nagy Ferenc</Nev>
            <Vegzettseg>Gépész</Vegzettseg>
            <Eletkor>55</Eletkor>
        </MuszakVezeto>

        <!-- Több szakmunkás -->
        <Szakmunkas Kod="SZ1">
            <Nev>Szabó Gábor</Nev>
            <Vegzettseg>Kisegítő</Vegzettseg>
            <Eletkor>32</Eletkor>
        </Szakmunkas>
        <Szakmunkas Kod="SZ2">
            <Nev>Kovács László</Nev>
            <Vegzettseg>Villanyszerelő</Vegzettseg>
            <Eletkor>45</Eletkor>
        </Szakmunkas>

        <!-- Több gyakornok -->
        <Gyakornok Kod="Gyak1">
            <Nev>Illés Dániel</Nev>
            <Eletkor>20</Eletkor>
        </Gyakornok>
        <Gyakornok Kod="Gyak2">
            <Nev>Hegedűs Emese</Nev>
            <Eletkor>22</Eletkor>
        </Gyakornok>

        <!-- Több megrendelő -->
        <Megrendelo>
            <Nev>Máv Zrt.</Nev>
            <Cim>
                <Varos>Budapest</Varos>
                <Utca>Máv</Utca>
                <Hazszam>32</Hazszam>
            </Cim>
            <Telefonszam>+36 20 456 4353</Telefonszam>
        </Megrendelo>
        <Megrendelo>
            <Nev>Volánbusz Zrt.</Nev>
            <Cim>
                <Varos>Debrecen</Varos>
                <Utca>Nagyerdei körút</Utca>
                <Hazszam>5</Hazszam>
            </Cim>
            <Telefonszam>+36 30 123 4567</Telefonszam>
        </Megrendelo>

        <!-- Több termék a rendelésben -->
        <Rendeles>
            <Termek>Vasúti Sín</Termek>
            <Termek>Acél Lemez</Termek>
            <Termek>Csavar</Termek>
            <Osszeg>12345654.00</Osszeg>
            <Datum>2024-03-21</Datum>
        </Rendeles>
        <Rendeles>
            <Termek>Betongerenda</Termek>
            <Termek>Acélcső</Termek>
            <Osszeg>5789000.00</Osszeg>
            <Datum>2024-04-10</Datum>
        </Rendeles>
    </Gyar>
</Ipar>
